{
  "schema_version": "1.0",
  "mode": "full-suite",
  "language": "en",
  "paper": "A4",
  "entity_id": "aster",
  "fictional": true,
  "fields": {
    "company.entity_id": {
      "value": "aster",
      "status": "VERIFIED_PRIMARY",
      "source_id": "fictional-record",
      "locator": "synthetic fixture identity record",
      "observed_at": "2026-10-01",
      "sha256": null,
      "scope": "aster",
      "verification": "Fictional demonstration only; no real identity or legal verification"
    },
    "company.trading_name": {
      "value": "Aster Works",
      "status": "VERIFIED_PRIMARY",
      "source_id": "fictional-record",
      "locator": "synthetic fixture identity record",
      "observed_at": "2026-10-01",
      "sha256": null,
      "scope": "aster",
      "verification": "Fictional demonstration only; no real identity or legal verification"
    },
    "company.legal_name": {
      "value": "Synthetic International Collaborative Design and Operations Research Company Limited",
      "status": "VERIFIED_PRIMARY",
      "source_id": "fictional-record",
      "locator": "synthetic fixture identity record",
      "observed_at": "2026-10-01",
      "sha256": null,
      "scope": "aster",
      "verification": "Fictional demonstration only; no real identity or legal verification"
    },
    "company.entity_type": {
      "value": "fictional limited company",
      "status": "VERIFIED_PRIMARY",
      "source_id": "fictional-record",
      "locator": "synthetic fixture identity record",
      "observed_at": "2026-10-01",
      "sha256": null,
      "scope": "aster",
      "verification": "Fictional demonstration only; no real identity or legal verification"
    },
    "company.jurisdiction": {
      "value": "Fictional Example Territory",
      "status": "VERIFIED_PRIMARY",
      "source_id": "fictional-record",
      "locator": "synthetic fixture identity record",
      "observed_at": "2026-10-01",
      "sha256": null,
      "scope": "aster",
      "verification": "Fictional demonstration only; no real identity or legal verification"
    },
    "company.registered_office": {
      "value": "12 Example Walk, Sample City, EX 1000",
      "status": "VERIFIED_PRIMARY",
      "source_id": "fictional-record",
      "locator": "synthetic fixture identity record",
      "observed_at": "2026-10-01",
      "sha256": null,
      "scope": "aster",
      "verification": "Fictional demonstration only; no real identity or legal verification"
    },
    "company.mailing_address": {
      "value": "Suite 1234, An Intentionally Long Fictional Address for Wrapping Tests, Example Business Campus, Sample City, Fictional District, EX 100000",
      "status": "VERIFIED_PRIMARY",
      "source_id": "fictional-record",
      "locator": "synthetic fixture identity record",
      "observed_at": "2026-10-01",
      "sha256": null,
      "scope": "aster",
      "verification": "Fictional demonstration only; no real identity or legal verification"
    },
    "company.registration_identifier": {
      "value": "SYNTHETIC-REG-001",
      "status": "VERIFIED_PRIMARY",
      "source_id": "fictional-record",
      "locator": "synthetic fixture identity record",
      "observed_at": "2026-10-01",
      "sha256": null,
      "scope": "aster",
      "verification": "Fictional demonstration only; no real identity or legal verification"
    },
    "company.tax_identifier": {
      "value": "SYNTHETIC-TAX-001",
      "status": "VERIFIED_PRIMARY",
      "source_id": "fictional-record",
      "locator": "synthetic fixture identity record",
      "observed_at": "2026-10-01",
      "sha256": null,
      "scope": "aster",
      "verification": "Fictional demonstration only; no real identity or legal verification"
    },
    "company.email": {
      "value": "hello@example.invalid",
      "status": "VERIFIED_PRIMARY",
      "source_id": "fictional-record",
      "locator": "synthetic fixture identity record",
      "observed_at": "2026-10-01",
      "sha256": null,
      "scope": "aster",
      "verification": "Fictional demonstration only; no real identity or legal verification"
    },
    "company.website": {
      "value": "https://example.invalid",
      "status": "VERIFIED_PRIMARY",
      "source_id": "fictional-record",
      "locator": "synthetic fixture identity record",
      "observed_at": "2026-10-01",
      "sha256": null,
      "scope": "aster",
      "verification": "Fictional demonstration only; no real identity or legal verification"
    },
    "company.description": {
      "value": "Fictional workflow software for small design teams",
      "status": "VERIFIED_PRIMARY",
      "source_id": "fictional-record",
      "locator": "synthetic fixture identity record",
      "observed_at": "2026-10-01",
      "sha256": null,
      "scope": "aster",
      "verification": "Fictional demonstration only; no real identity or legal verification"
    },
    "employee.full_name": {
      "value": "Alex Example",
      "status": "VERIFIED_PRIMARY",
      "source_id": "fictional-record",
      "locator": "synthetic fixture identity record",
      "observed_at": "2026-10-01",
      "sha256": null,
      "scope": "aster",
      "verification": "Fictional demonstration only; no real identity or legal verification"
    },
    "signatory.full_name": {
      "value": "Morgan Sample",
      "status": "VERIFIED_PRIMARY",
      "source_id": "fictional-record",
      "locator": "synthetic fixture identity record",
      "observed_at": "2026-10-01",
      "sha256": null,
      "scope": "aster",
      "verification": "Fictional demonstration only; no real identity or legal verification"
    },
    "signatory.capacity": {
      "value": "authorized director for specified transaction",
      "status": "VERIFIED_PRIMARY",
      "source_id": "fictional-record",
      "locator": "synthetic fixture identity record",
      "observed_at": "2026-10-01",
      "sha256": null,
      "scope": "aster",
      "verification": "Fictional demonstration only; no real identity or legal verification"
    },
    "signatory.authority_reference": {
      "value": "Fictional board decision DEMO-001; not adopted",
      "status": "VERIFIED_PRIMARY",
      "source_id": "fictional-record",
      "locator": "synthetic fixture identity record",
      "observed_at": "2026-10-01",
      "sha256": null,
      "scope": "aster",
      "verification": "Fictional demonstration only; no real identity or legal verification"
    },
    "counterparty.legal_name": {
      "value": "Example Client Studio Ltd",
      "status": "VERIFIED_PRIMARY",
      "source_id": "fictional-record",
      "locator": "synthetic fixture identity record",
      "observed_at": "2026-10-01",
      "sha256": null,
      "scope": "aster",
      "verification": "Fictional demonstration only; no real identity or legal verification"
    },
    "counterparty.capacity": {
      "value": "designated representative; authority to verify",
      "status": "VERIFIED_PRIMARY",
      "source_id": "fictional-record",
      "locator": "synthetic fixture identity record",
      "observed_at": "2026-10-01",
      "sha256": null,
      "scope": "aster",
      "verification": "Fictional demonstration only; no real identity or legal verification"
    },
    "recipient.name": {
      "value": "Example Procurement Team",
      "status": "VERIFIED_PRIMARY",
      "source_id": "fictional-record",
      "locator": "synthetic fixture identity record",
      "observed_at": "2026-10-01",
      "sha256": null,
      "scope": "aster",
      "verification": "Fictional demonstration only; no real identity or legal verification"
    },
    "recipient.address": {
      "value": "24 Example Avenue, Sample City",
      "status": "VERIFIED_PRIMARY",
      "source_id": "fictional-record",
      "locator": "synthetic fixture identity record",
      "observed_at": "2026-10-01",
      "sha256": null,
      "scope": "aster",
      "verification": "Fictional demonstration only; no real identity or legal verification"
    }
  },
  "brand": {
    "primary": "#20586b",
    "ink": "#172b35",
    "accent": "#bb6f3b",
    "font": "Arial",
    "logo": "tests/fixtures/logo.svg",
    "logo_rights": "Original synthetic geometry, MIT; no third-party trademark",
    "stamp_company_mm": 80,
    "stamp_signatory_mm": [
      62,
      25
    ]
  },
  "sources": [
    {
      "id": "fictional-record",
      "kind": "synthetic",
      "locator": "tests/fixtures/full.json",
      "sha256": null,
      "scope": "aster fictional identity only"
    }
  ],
  "reviewed_paths": [
    {
      "path": "README.md",
      "sha256": "5e3adabea9fddb500c8872e38a9c3aa1d1f24a2f1d6f6f42d921027243d32770",
      "depth": "REVIEWED_SYNTHETIC_FIXTURE",
      "claims": [
        "README describes a planned adapter only"
      ]
    },
    {
      "path": "routes.js",
      "sha256": "d1acb39c9ff358c1162a003fc1f8655c5179d67a0860b3ac4407e7842b5102a2",
      "depth": "REVIEWED_SYNTHETIC_FIXTURE",
      "claims": [
        "Three exported route labels; no payment execution"
      ]
    },
    {
      "path": "theme.css",
      "sha256": "6f65129b9d4c8f5d95b83dd7a46ff6b6a5d55812a3aae6fe97889b923bf1769c",
      "depth": "REVIEWED_SYNTHETIC_FIXTURE",
      "claims": [
        "One explicit brand CSS variable"
      ]
    }
  ],
  "contradictions": [],
  "website": {
    "authorized": false,
    "url": null,
    "budget": 10
  },
  "applicability": {},
  "terms": {
    "brand.positioning": "Proposed: considered workflow tools for small design teams",
    "brand.audience": "Independent design studios and their project leads",
    "brand.attributes": "Precise, calm, useful",
    "brand.voice": "Clear, measured and direct",
    "brand.clear_space": "One height of the central square module on each side",
    "document.date": "2026-10-01",
    "document.reference": "DEMO-2026-001",
    "agreement.reference": "DEMO-MSA-001",
    "agreement.version": "draft 0.1",